{"$schema":"../../schema/calculations.schema.json","schema_version":"1.0.0","form_id":"1600vt-v2018","revision":"2018-01-01","evaluation_order":["1600vt-atc-row","1600vt-additional-atc-total","1600vt-item18","1600vt-item21","1600vt-item22","1600vt-item26","1600vt-item27","1600vt-s1-row","1600vt-s1-total"],"calculations":[
{"calculation_id":"1600vt-atc-row","outputs":["frm1600VT:txtPg1P2TaxWithheldN"],"inputs":["frm1600VT:txtPg1P2TaxBaseN","frm1600VT:txtPg1P2TaxRateN"],"condition":null,"official_formula":"Tax withheld = tax base × tax rate / 100.","rounding":"toFixed(2), then formatCurrency.","trigger":"pageOneTaxWithheldComputation/getRequiredWithheld","depends_on":[],"source_refs":["official-hta-runtime#pageOneTaxWithheldComputation:L3357-L3365","official-hta-runtime#getRequiredWithheld:L3380-L3384"],"assessment":"verified-correct","recommended_app_behavior":"Use decimal arithmetic.","confidence":"high"},
{"calculation_id":"1600vt-additional-atc-total","outputs":["frm1600VT:txtTotalOtherTax"],"inputs":["frm1600VT:txtPg1P2TaxWithheld6..N"],"condition":"More than five ATC rows are materialized.","official_formula":"Sum withheld rows 6 through N.","rounding":"formatCurrency.","trigger":"computeTotalOtherWithheldTax","depends_on":["1600vt-atc-row"],"source_refs":["official-hta-runtime#computeTotalOtherWithheldTax:L3400-L3408"],"assessment":"verified-correct","recommended_app_behavior":"Use decimal summation.","confidence":"high"},
{"calculation_id":"1600vt-item18","outputs":["frm1600VT:txtPg1P2I18TotTaxWithheld"],"inputs":["withheld rows 1..5","frm1600VT:txtTotalOtherTax"],"condition":null,"official_formula":"18 = rows 1 + 2 + 3 + 4 + 5 + additional-row subtotal.","rounding":"toFixed(2), then formatCurrency.","trigger":"pageOneComputation","depends_on":["1600vt-atc-row","1600vt-additional-atc-total"],"source_refs":["official-hta-runtime#pageOneComputation:L3410-L3421"],"assessment":"verified-correct","recommended_app_behavior":"Sum each materialized row exactly once using decimals.","confidence":"high"},
{"calculation_id":"1600vt-item21","outputs":["frm1600VT:txtPg1P2I21TotTaxPymntsMade"],"inputs":["frm1600VT:txtPg1P2I19TaxRemittedInRtrn","frm1600VT:txtPg1P2I20OthrPymntsMade"],"condition":null,"official_formula":"21 = 19 + 20.","rounding":"toFixed(2), then formatCurrency.","trigger":"pageOneComputation","depends_on":[],"source_refs":["official-hta-runtime#pageOneComputation:L3423-L3428"],"assessment":"verified-correct","recommended_app_behavior":"Use decimal addition.","confidence":"high"},
{"calculation_id":"1600vt-item22","outputs":["frm1600VT:txtPg1P2I22TaxStillDueOverremit"],"inputs":["frm1600VT:txtPg1P2I18TotTaxWithheld","frm1600VT:txtPg1P2I21TotTaxPymntsMade"],"condition":null,"official_formula":"22 = 18 - 21.","rounding":"toFixed(2), then formatCurrency.","trigger":"pageOneComputation","depends_on":["1600vt-item18","1600vt-item21"],"source_refs":["official-hta-runtime#pageOneComputation:L3430-L3435"],"assessment":"verified-correct","recommended_app_behavior":"Use decimal subtraction.","confidence":"high"},
{"calculation_id":"1600vt-item26","outputs":["frm1600VT:txtPg1P2I26TotPenalties"],"inputs":["frm1600VT:txtPg1P2I23Surcharge","frm1600VT:txtPg1P2I24Interest","frm1600VT:txtPg1P2I25Compromise"],"condition":null,"official_formula":"26 = 23 + 24 + 25.","rounding":"toFixed(2), then formatCurrency.","trigger":"pageOneComputation","depends_on":[],"source_refs":["official-hta-runtime#pageOneComputation:L3437-L3443"],"assessment":"verified-correct","recommended_app_behavior":"Use decimal addition.","confidence":"high"},
{"calculation_id":"1600vt-item27","outputs":["frm1600VT:txtPg1P2I27TotAmtStillDueOverremit"],"inputs":["frm1600VT:txtPg1P2I22TaxStillDueOverremit","frm1600VT:txtPg1P2I26TotPenalties"],"condition":"If Item 22 is negative and Item 26 positive, output only Item 26; otherwise add them.","official_formula":"27 = (22 < 0 and 26 > 0) ? 26 : 22 + 26.","rounding":"toFixed(2), then formatCurrency.","trigger":"pageOneComputation","depends_on":["1600vt-item22","1600vt-item26"],"source_refs":["official-hta-runtime#pageOneComputation:L3445-L3457"],"assessment":"incorrect-official-behavior","recommended_app_behavior":"Apply the legally reviewed overremittance/penalty rule explicitly; do not silently discard Item 22.","confidence":"high"},
{"calculation_id":"1600vt-s1-row","outputs":["frm1600VT:Pg2Sc1AmtOfTxWthhldN"],"inputs":["frm1600VT:Pg2Sc1AmtOfIncPmtN","frm1600VT:Pg2Sc1TaxRateN"],"condition":"Schedule 1 row exists.","official_formula":"Column 7 = Column 5 × Column 6 / 100.","rounding":"toFixed(2), then formatCurrency.","trigger":"pageTwoComputation","depends_on":[],"source_refs":["official-hta-runtime#pageTwoComputation:L3459-L3466"],"assessment":"verified-correct","recommended_app_behavior":"Use decimal multiplication.","confidence":"high"},
{"calculation_id":"1600vt-s1-total","outputs":["frm1600VT:Pg2Sc1TotTxWthhldAndRmtted"],"inputs":["frm1600VT:Pg2Sc1AmtOfTxWthhld1..5"],"condition":null,"official_formula":"Schedule 1 total = sum rows 1 through 5.","rounding":"formatCurrency after every incremental addition.","trigger":"totTaxWithheldAndRemitted","depends_on":["1600vt-s1-row"],"source_refs":["official-hta-runtime#totTaxWithheldAndRemitted:L3449-L3457"],"assessment":"official-bug-compatible","recommended_app_behavior":"Sum decimals once, then round at the required boundary.","confidence":"high"}
]}
